date,title,polarity,subjectivity,classification
20140912,The Morning Ledger: EBay's Strategy for Successful M&A,0.75,0.95,pos
20140912,Analysts Boost Targets After Apple's Product Blitz,0.0,0.0,neu
20140912,Card Issuers Jump Onto Apple Pay Bandwagon,0.0,0.0,neu
20140912,EBay Options Shares See Heavy Trading Before Google Rumors Squashed,-0.2,0.5,neg
20140912,Facebook-Created Database Software Finds Use in Financial Services,0.0,0.0,neu
20140914,Gherkin Building Gets a Big Apple Push,0.0,0.1,neu
20140914,Proceedings: Highlights From the Law Blog,0.0,0.0,neu
20140915,The Morning Download: Banks Adopt New Database Technology as IT Infrastructure Is Challenged,0.13636363636363635,0.45454545454545453,pos
20140915,Companies' Stock Buybacks Help Buoy the Market,0.0,0.0,neu
20140915,Stocks to Watch: Cognizant RadioShack Microsoft,0.0,0.0,neu
20140915,Apple Pay Won't Replace Your Local Bank Branch Analyst Says,0.0,0.0,neu
20140915,Apple Reports Record Preorders for New iPhone 6,0.13636363636363635,0.45454545454545453,pos
20140916,Apple's $368 Million Patent Infringement Judgment Tossed By Appeals Court,0.0,0.0,neu
20140916,Chinese Worker Detained for Giving Customers a Sneak Peek at iPhone 6,0.0,0.0,neu
20140916,Apple Pay Form Factor a Challenge Says Restaurant CIO,0.0,0.0,neu
20140916,Corruption Currents: From Office 39 to Strict US Ransom Policy,0.0,0.0,neu
20140916,Internet Power Balance Tilts Toward Asia,0.0,0.0,neu
20140916,Apple's $368 Million Patent Judgment Tossed By Appeals Court,0.0,0.0,neu
20140916,OECD Takes Aim at Improper Profit Shifting,0.0,0.0,neu
20140916,The Morning Ledger: The Double-Edged Sword of the JOBS Act,0.0,0.0,neu
20140916,G-20 Plans to Overhaul International Corporate Tax System Still on Track,0.0,0.0,neu
20140916,In Alibaba IPO Investors Offer Views of Risk and Opportunity,0.0,0.0,neu
20140916,The Morning Download: Majority of Business Leaders View IT as Strategic Tool HBR Says,0.0,0.0,neu
20140916,How Does India's $33 Smartphone Stack Up Against the iPhone 6?,0.0,0.0,neu
20140917,The Morning Download: Get Ready for the Dawn of Network Virtualization,0.2,0.5,pos
20140917,Corporate Watch,0.0,0.0,neu
20140917,Sony Turnaround Effort Falters Expects $2.15 Billion Yearly Loss,0.0,0.0,neu
20140917,Money-Market Fund Changes May Have Uneven Impact on Companies,-0.2,0.2,neg
20140917,Apple Puts Focus on Security,0.0,0.0,neu
20140917,FedEx Profit Jumps 24% As Revenue Rises Across Segments,0.0,0.0,neu
20140917,Video: After Federal Reserve Rate Decision Yellen Reviews Economic Outlook,0.2,0.2,pos
20140917,CMO Today: Budweiser Pushes Back at the NFL,0.0,0.0,neu
20140918,Sweden's Klarna to Enter U.S. Online Payment Market,0.0,0.0,neu
20140918,Michael Chasen: Trekking Where No Entrepreneur Has Gone Before,0.0,0.0,neu
20140918,The Morning Risk Report: FASB FRC Wonder-Will You Be In Business Tomorrow?,0.0,0.0,neu
20140918,The Morning Download: Islamic State Poses Potential Cyber Threat to Companies,0.0,1.0,neu
20140918,Google Helps Japanese Game Makers Expand Overseas,-0.2,0.2,neg
20140918,Monetise Finds Visa Refused in Mobile Payments,0.0,0.0,neu
20140918,The Morning Ledger: New Money-Fund Rules Highlight Different Cash Strategies,0.06818181818181818,0.5272727272727272,pos
20140918,Japanese Minister Tells Mobile Carriers to Cool Price Wars Ahead of iPhone Launch,0.175,0.325,pos
20140918,iPhone 6 Goes on Sale in Japan,0.0,0.0,neu
20140918,Apple iPhone Demand Impresses Ahead of Launch: Survey,0.0,0.0,neu
20140918,More iPhones Fewer Sonys Mean More Deficits for Japan,0.22916666666666666,0.5625,pos
20140918,Larry Ellison to Step Aside as Oracle CEO,0.0,0.0,neu
20140918,Alibaba's IPO: We Know the Price! Now How Does It Stack Up?,0.0,0.0,neu
20140919,WSJ Photos of the Day: Sept 19,0.0,0.0,neu
20140919,Whole Foods CIO Invests to Satisfy Shopper Data Cravings,0.2,0.4,pos
20140919,The Morning Risk Report: SEC's Poor Collection Rate May Impede Whistleblowers,-0.25,0.6,neg
20140919,On the Complex Evolution Towards Mobile Digital Payments,-0.15,0.2,neg
20140919,Alibaba IPO Leaves Investors Wanting More,0.5,0.5,pos
20140919,Morning MoneyBeat: Alibaba Scotland and Quadruple Witching Oh My!,0.0,0.0,neu
20140919,Recap: Alibaba's Big Debut Minute-By-Minute,0.0,0.1,neu
20140919,Deals of the Day: Alibaba Edition,0.0,0.0,neu
20140919,Apple's New iPhones Start Selling in Stores,0.13636363636363635,0.45454545454545453,pos
20140921,Renren Seeks China's Next Innovation,0.0,0.0,neu
20140922,Apple Sells Over 10 Million New iPhones in First Weekend,0.19318181818181818,0.3939393939393939,pos
20140922,BlackBerry's Makeover Is Taking Shape,0.0,0.0,neu
20140922,The Morning Download: Oracle Plays Heavy Hand With Pricing CIOs Say,-0.2,0.5,neg
20140922,Taiwan Export Orders Get Lift From Apple's iPhone 6,0.0,0.0,neu
20140922,China's Hunger for Apple's New iPhone Fuels Smuggling,0.13636363636363635,0.45454545454545453,pos
20140922,5 Things To Read Today: Church and State Still Don't Mix Another Blackberry Phone And More,0.5,0.5,pos
20140922,BlackBerry CEO: New Smartphone Will Cost $599,0.13636363636363635,0.45454545454545453,pos
20140922,Taiwan's iPhone Boost: How Long Will it Last?,-0.025,0.23333333333333334,neg
20140922,Alibaba Deal Pummels Yahoo Stock,0.0,0.0,neu
20140922,New Level of Smartphone Encryption Alarms Law Enforcement,0.13636363636363635,0.45454545454545453,pos
20140922,Stocks to Watch: Sigma-Aldrich Apple Clorox,0.0,0.0,neu
20140923,Apple's New iPhone Pitch: Privacy,0.13636363636363635,0.45454545454545453,pos
20140923,The Morning Risk Report: More Pressure for Climate Change Disclosure,0.5,0.5,pos
20140923,The Morning Download: Facebook's New Ad Platform Suggests Cookie Era Is Crumbling,0.13636363636363635,0.45454545454545453,pos
20140923,Buyback Binge Takes a Breather,0.0,0.0,neu
20140923,Here Are the Top 20 Biggest Buybacks,0.5,0.5,pos
20140923,Apple's iPhone Is Retail's Grinch -- Heard on the Street,0.0,0.0,neu
20140923,The Morning Ledger: CFOs Forced to Think Green in Europe,-0.25,0.25,neg
20140923,Alibaba the Investor: How Its Startups View the Company,0.0,0.0,neu
20140923,Intel Taps Internet of Things to Predict Shop Floor Tool Failure,-0.3166666666666667,0.3,neg
20140923,Morning MoneyBeat: Bond Bubble Will Burst in a 'Very Bad Way',-0.9099999999999998,0.8666666666666667,neg
20140924,BlackBerry Unveils Its Passport Smartphone,0.0,0.0,neu
20140924,iPhone 6 Screen Size Issue Solved by Giant Thumb,0.0,1.0,neu
20140924,U.S. Morning Links: The Too-Thin iPhone,0.0,0.0,neu
20140924,The Morning Ledger: Inversions Targeted but Not Stopped,0.0,0.0,neu
20140924,CIO Journal: News Digest,0.0,0.0,neu
20140924,China's Tech Factories Turn to Student Labor,0.0,0.0,neu
20140924,Asian Shares Fall on Global Growth Worries,0.0,0.0,neu
20140924,Asian Morning Briefing: U.S. Stock Prices End Higher,0.125,0.25,pos
20140924,The Morning Download: Facebook Faces Merchant Backlash Over Use of Data,0.0,0.0,neu
20140924,Some Promising Trends For Startups to Propel,0.2,0.5,pos
20140924,Note-Taking App Evernote Considering IPO in Next Few Years,-0.1,0.05,neg
20140925,Security Drives Smoothie King's Choice of iPad Sales System,0.0,0.0,neu
20140925,The Morning Risk Report: Director Pay Rise Stems from Equity Grants,0.0,0.0,neu
20140925,The Morning Ledger: Could the End of Easy Cash for Low-Rated Firms Be Nigh?,0.43333333333333335,0.8333333333333334,pos
20140925,Apple Pulls iOS Software Update,0.0,0.0,neu
20140925,Stock to Watch: LipoScience Scholastic Boeing,0.0,0.0,neu
20140925,GameStop Plans to Increase Holiday Hiring,0.0,0.0,neu
20140925,Morning MoneyBeat: Margin Debt Is Elevated Not Excessive,0.125,1.0,pos
20140925,FBI Director 'Concerned' About New Smartphone Encryption,0.13636363636363635,0.45454545454545453,pos
20140925,FBI Director Raises Concerns About Smartphone-Security Plans,0.0,0.0,neu
20140925,U.S. Stocks Sharply Lower,-0.125,0.75,neg
20140925,Corruption Currents: From Anti-Cybercrime Platform to Rosneft's Deal,0.0,0.0,neu
20140925,The Morning Download: Security Hole Draws Heartbleed Comparisons,0.0,0.0,neu
20140925,Asian Morning Briefing: U.S. Stocks Tumble,0.0,0.0,neu
20140925,Apple Rebuts Complaints of Bending iPhones,0.0,0.0,neu
20140926,BlackBerry Posts Smaller-Than-Expected Loss,0.0,0.0,neu
20140926,The Morning Ledger: Offloading Pension Liabilities No Premium Required,0.0,0.0,neu
20140926,With Speedy Transition Gross May Have an Eye on Legacy,0.0,0.0,neu
20140926,5 Takeaways From BlackBerry's Big Week,0.0,0.1,neu
20140926,The Morning Download: Businesses Ride Shellshock Aftershocks,0.0,0.0,neu
20140928,SoftBank's Masayoshi Son Wants Dream Home for Alibaba Riches,0.2,0.1,pos
20140928,EU to Publish Details of Probes of Tax Deals Benefiting Apple Fiat,0.0,0.0,neu
20140929,The Morning Ledger: EU Challenges Apple's Tax Deals in Ireland,0.0,0.0,neu
20140929,The AM Roundup: Winning Asylum Grows Tougher; EU To Explain Apple  Greenberg Challenges AIG Bailout,0.5,0.75,pos
20140929,Stocks to Watch: DreamWorks Animation Athlon Energy Tibco Software,0.0,0.0,neu
20140929,The Morning Risk Report: Money Laundering Worries Widen Beyond Banks,0.0,0.0,neu
20140929,Microsoft to Open Fifth Avenue Store,0.0,0.5,neu
20140929,Corruption Currents: From Striking Oil to Rossiya's Rise,0.5,1.0,pos
20140929,The Morning Download: Facebook Ad Platform Injects More Data Into Social Media Campaigns,0.26666666666666666,0.2833333333333333,pos
20140929,Hong Kong Banks Hit by Protests,0.0,0.0,neu
20140929,Microsoft to Unveil Next Version of Windows,0.0,0.0,neu
20140929,EU to Publish Details of Tax Deals Benefiting Apple Fiat on Tuesday,0.0,0.0,neu
20140930,Corporate Bond Sales Coming at Blockbuster Pace,0.0,0.0,neu
20140930,The Morning Download: Microsoft Shifts New Windows Focus Back to Enterprise,0.06818181818181818,0.22727272727272727,pos
20140930,Weil Gotshal Hops on the (Real Estate) Downsizing Bandwagon,0.2,0.30000000000000004,pos
20140930,Carl Icahn on EBay's PayPal Split: 'Earlier Than We Expected',-0.05,0.45,neg
20140930,How Apple's Tax Structure Works,0.0,0.0,neu
20140930,5 Takeaways From The EU's Apple Ireland Tax Probe,0.0,0.0,neu
20140930,Morning MoneyBeat: A Reason for Hope in the Fourth Quarter,0.0,0.0,neu
20140930,CMO Today: FCC Eyes Over-the-Top TV Players,-0.5,1.0,neg
20140930,Nevada Ranch Headed to Auction,0.0,0.0,neu
20140930,Samsung Takes Korea's Stock Market Down With It,-0.15555555555555559,0.2888888888888889,neg
20140930,Japan Airlines Reports Hacker Attack,0.0,0.0,neu
20140930,EU Believes Apple Fiat Tax Deals Broke Rules,0.0,0.0,neu
20140930,Fiat Apple Tax Deals Violated 'State Aid' Rules Says EU,0.0,0.0,neu
20140930,Train Reading: The Federal Reserve Needs a Good Editor,0.7,0.6000000000000001,pos
20140930,Analyst on EBay: Limited Upside After Paypal Spinoff,-0.07142857142857142,0.14285714285714285,neg
20140930,London Targets Corporate Tax Strategies,0.0,0.0,neu
20140930,General Catalyst Dedicates $10M for Startups Built on Stripe Payment Tech,0.05000000000000002,0.5,pos
20140930,Corporate Watch,0.0,0.0,neu
20140930,On Apple Fiat and Corporate Tax Arbitrage,0.0,0.0,neu
20140930,Market Talk: EBay Eurozone Economics and Apple,0.0,0.0,neu
20140930,The Morning Risk Report: IM Use Complicates FCPA Probes,0.0,0.0,neu
20140930,China iPhone 6 Sales to Start Oct. 17,0.0,0.0,neu
20140930,EBay Reverses Course Decides to Spin Off PayPal,0.0,0.0,neu
20141001,EBay Faces Slower Growth Increasing Competition Without PayPal,0.0,0.0,neu
20141001,Carl Icahn Gets His Way... Eventually: A Brief History,0.0,0.3333333333333333,neu
20141001,Chip Designer ARM Holdings Unveils Operating System,0.0,0.0,neu
20141001,Corruption Currents: From Ben Aissa's Plea to Warrantless Surveillance,0.0,0.0,neu
20141001,Facebook Aims to Shrink Google's Lead in Digital Ads,0.0,0.0,neu
20141001,EMC Names Former Apple United Executive as Finance Chief,0.0,0.0,neu
20141001,The Morning Ledger: Sector Shifts Paved Way for eBay-PayPal Split,0.0,0.0,neu
20141001,Scotiabank's Tangerine Unit Launches Biometric Banking,0.0,0.0,neu
20141001,Morning MoneyBeat Europe: Stocks Tipped to Struggle As Key ECB Meet Looms.,0.0,1.0,neu
20141001,Companies Should Think Like Activists,0.0,0.0,neu
20141001,EMC Taps Former Apple United Executive for CFO Post,0.0,0.0,neu
20141001,The Morning Download: Goldman Sachs-Led Messaging Deal May Change the Way Banks Chat,0.0,0.0,neu
20141001,Authors Guild Met With DoJ to Seek Investigation Into Amazon's Practices,0.0,0.0,neu
20141002,Stocks to Watch: Constellation Brands Esperion Sears,0.0,0.0,neu
20141002,Cellphone Boom Spurs Antenna-Safety Worries,0.0,0.0,neu
20141002,Startup Investors Become Pitchmen Under Loosened Securities Rules,0.0,0.0,neu
20141002,Lawyer Representing Photo-Hack Victims Taking Aim at Google,0.0,0.0,neu
20141002,Google Dragged into Celebrity Nude Photo Fracas,0.0,0.0,neu
20141002,Canada Stocks to Watch: Sears Canada CP Agrium Wi-LAN and more,0.5,0.5,pos
20141002,Corruption Currents: From Disqualifying Companies to Raiding Lukoil's Offices,0.0,0.0,neu
20141002,Samsung's Galaxy Note 4 Contends With 'Gapgate',0.0,0.0,neu
20141002,EU Should Pursue Big Companies Over Tax Deals: Official,0.0,0.1,neu
20141002,The Morning Download: Facing Data Tsunami Weather Channel Undergoes 'Radical' IT Shift,0.0,0.0,neu
20141002,Angry Birds Maker Rovio to Cut up to 130 Jobs in Finland,-0.5,1.0,neg
20141003,Samsung Adopts Nimble Approach to Deals,0.0,0.0,neu
20141003,The Morning Ledger: Inversion Crackdown Makes Its First Kill,0.25,0.3333333333333333,pos
20141003,The Morning Risk Report: Big Anti-Money Laundering Fines Reshaping Banking,0.0,0.1,neu
20141003,Three Must-Read Articles,0.0,0.0,neu
20141003,The Morning Download: CIOs Play Deeper Role in Leadership of Business,0.0,0.0,neu
20141003,Samsung Paid Microsoft $1 Billions Last Year for Android Phone Royalty Court Filing Says,0.0,0.06666666666666667,neu
20141003,Google to Make Security Guards Employees Rather Than Contractors,0.0,0.0,neu
20141003,Hong Kong Protests Weigh on Swiss Watch Industry,0.0,0.0,neu
20141003,What Your CEO Is Reading: Apple's Ive; Elon Musk's Martian Quest; Women in Tech,0.0,0.0,neu
20141003,EU Closes Telecoms Investigation,0.0,0.0,neu
20141003,HTC Posts Second Straight Quarterly Profit,0.1,0.2,pos
20141004,France to Push Digital Reforms Within EU,0.0,0.0,neu
20141005,What's Behind Japan's Profit Rebound? Unsexy Companies Like Toray,-0.4,0.7,neg
20141006,Square Raises $150 Million Amid Mounting Threats from Apple PayPal,0.0,0.0,neu
20141006,Samsung to Invest $14.7 Billion in Chip Plant,0.0,0.0,neu
20141006,NBA to Cash In on New Rights Deals With Disney Time Warner,0.13636363636363635,0.45454545454545453,pos
20141006,Apple's Sapphire Partner GT Advanced Files for Bankruptcy,0.4,0.6,pos
20141006,A Boon for Short Sellers: Apple Partner GT Advanced Files for Bankruptcy,0.2,0.44999999999999996,pos
20141006,The Morning Download: CIOs Weigh Impact of H-P Split,0.0,0.0,neu
20141006,Hewlett-Packard Move Highlights the Disruption in Tech,0.0,0.0,neu
20141006,H-P is the Latest Corporate Divorce Among Companies Facing Upheaval,0.25,0.45,pos
20141006,Square Gets Support of $150 Million,0.0,0.0,neu
20141007,Overtime for Lawyers,0.0,0.0,neu
20141007,Asian Morning Briefing: U.S. Stocks Close Sharply Lower,-0.0625,0.375,neg
20141007,Taiwan's Export Growth Slips,0.0,0.0,neu
20141007,Stocks to Watch: SodaStream Christopher & Banks GM,0.0,0.0,neu
20141007,Deals of the Day: Glencore's Personal Approach Hilton Sells Waldorf,0.0,0.3,neu
20141007,EU Opens Probe Into Amazon's Tax Affairs in Luxembourg,0.0,0.0,neu
20141007,Twitter Sues U.S. Government Over Data Requests,0.0,0.0,neu
20141007,The Morning Risk Report: Acquiring Mission-Driven Enterprises Is Risky,0.0,0.0,neu
20141007,In New EU Digital Commissioner U.S. Tech Faces Hardliner,0.06818181818181818,0.22727272727272727,pos
20141007,Voice Controls In Cars Really are Driving You to Distraction,0.2,0.2,pos
20141007,Satya Nadella Pitches Microsoft 'Difference' to CIOs,0.0,0.0,neu
20141007,The Morning Download: CIOs Driving Digital Leadership but Not as Much as They Think,0.1,0.1,pos
20141007,The Daily Docket: GT Advanced Bankruptcy Triggered by Payment Dispute,0.2,0.3,pos
20141007,The Morning Ledger: Firms Shed Pensions and Cut Fees to Government Insurer in the Process,0.0,0.0,neu
20141008,Google's Schmidt Says Encrypted Phones Won't Thwart Police,0.0,0.0,neu
20141008,Morning MoneyBeat Asia: Markets Churning But Not Moving,-0.5,0.9,neg
20141008,Global PC Shipments Fell in 3rd Quarter,0.0,0.0,neu
20141008,U.S. Supreme Court Considers Pay for Amazon Workers' Security Checks,0.0,0.0,neu
20141008,Apple Others Surprised by GT's Bankruptcy Filing,0.1,0.9,pos
20141008,Carl Icahn to Send 'Interesting' Letter to Apple CEO,0.5,0.5,pos
20141008,Finally a $100 Tablet Worth Buying,0.15,0.55,pos
20141008,Nobel Prize for LED a Morale Booster for Japanese Electronics,0.0,0.0,neu
20141008,The Morning Download: Microsoft CEO Nadella Lays Out Hybrid Cloud Strategy,0.0,0.0,neu
20141008,Smartphone Maker HTC Introduces Waterproof Selfie Camera,0.0,0.0,neu
20141008,Google's Tax Setup Faces French Challenge,0.0,0.0,neu
20141008,How Google's French Tax Structure Works,0.0,0.0,neu
20141008,Morning MoneyBeat: Buckle Up,0.0,0.0,neu
20141008,The Accelerators: One Founder Or More?,0.5,0.5,pos
20141009,'Shares at Half Price': Read Carl Icahn's New Letter to Apple,-0.015151515151515152,0.3106060606060606,neg
20141009,Why Carl Icahn Thinks Apple Shares Are Worth $203,0.3,0.1,pos
20141009,Stocks to Watch: Apple PepsiCo Auxilium Pharmaceuticals,0.0,0.0,neu
20141009,Morning MoneyBeat Asia: Market Assumptions Looking Shaky,-0.3333333333333333,0.5,neg
20141009,Foxconn Workers Walk Off Job at Chinese Plant,0.0,0.0,neu
20141009,Digits: Google Phone to Intensify Phablet Competition,0.0,0.0,neu
20141009,Starboard Tastes Victory at Olive Garden Parent Darden,0.0,0.0,neu
20141009,Corporate Watch: News Digest,0.0,0.0,neu
20141009,GT Advanced Wants to Keep Issues With Apple Secret,0.0666666666666667,0.4666666666666666,pos
20141009,Amazon Store's Block on 34th Street Already Home to Big Retailers,0.0,0.1,neu
20141009,AM Roundup: Justices Allow NC Voter Restrictions; More Protests in Missouri; Google Rejects Encryption Concerns,0.5,0.5,pos
20141009,The Daily Docket: Union Protests Trump Bid to Cut Benefits,0.0,0.0,neu
20141009,The Morning Download: Critical Infrastructure at Risk Because of Careless Exposure to Internet,-0.25,0.8500000000000001,neg
20141009,Amazon Sets New Store on Busy Midtown Block,0.11818181818181818,0.37727272727272726,pos
20141009,Apple Supplier Looks to End Production,0.0,0.0,neu
20141009,Icahn Pushes Apple to Buy Back More Stock,0.25,0.25,pos
20141009,Deals of the Day: Icahn Writes to Apple Endo Nabs Auxilium,0.0,0.0,neu
20141009,Larger Apple iPad to Be Delayed,0.0,0.5,neu
20141009,For Fastenal Past Isn't Prologue--Ahead of the Tape,-0.25,0.25,neg
20141009,The Morning Ledger: France Targets Google in Tax Crackdown,0.0,0.0,neu
20141009,Amazon in Talks to Join Digital Locker for Movies,0.0,0.0,neu
20141009,Carl Icahn Reveals Performance of Son Brett's Portfolio,0.0,0.0,neu
20141010,The Morning Risk Report: Treasury Says Money-Transmitters Help People Too,0.0,0.0,neu
20141010,Beats Bose Settle Headphone Patent Dispute,0.0,0.0,neu
20141010,Morning MoneyBeat Europe: Stocks Tipped to Wilt as Europe Back in Crosshairs,0.0,0.0,neu
20141010,Morning MoneyBeat: Whiplash Hits Wall Street,0.0,0.0,neu
20141010,Alcatel Looks to Hone Future Technologies in Japan,0.0,0.125,neu
20141010,Macy's Tries on Silicon Valley's 'Fail Fast' Approach,-0.13333333333333333,0.4333333333333333,neg
20141010,The Daily Docket: Apple Supplier GT Advanced Plans to Wind Down Sapphire Business,0.08148148148148147,0.2962962962962963,pos
20141010,Inventing a GMO Apple That Won't Brown,0.0,0.0,neu
20141010,GT Advanced to Close Arizona Massachusetts Sapphire Plants,0.4,0.6,pos
20141010,Deals of the Day: Symantec to Split Gross Speaks Starboard Tastes Victory,0.0,0.0,neu
20141010,The Morning Ledger: Early Inversion Deal Makers Come Back for More,0.19999999999999998,0.26666666666666666,pos
20141010,The Morning Download: CIOs Must Reboot Human Networks as M&A Heats Up,0.0,0.1,neu
20141010,Chip Maker's Warning Rattles Entire Sector,0.0,0.625,neu
20141010,What Satya Nadella Got Right About Raises,0.2857142857142857,0.5357142857142857,pos
20141012,The Big Mystery: What's Big Data Really Worth?,0.09999999999999999,0.10000000000000002,pos
20141012,Corporate Watch: New Digest,0.06818181818181818,0.22727272727272727,pos
20141012,A Force in Tech Fests Pushes Forward,0.0,0.0,neu
20141012,Ireland Considers Closing Corporate-Tax Loophole,0.0,0.0,neu
20141013,The First $1 Trillion Company? Why Google Could Beat Apple to Milestone,0.25,0.3333333333333333,pos
20141013,The Daily Docket: Endeavour International Enters Bankruptcy,0.0,0.0,neu
20141013,European Telecoms Providers Gear Up for Connected Wireless Fight,0.0,0.0,neu
20141013,The Morning Download: Businesses Struggle to Put a Value on Data,0.0,0.0,neu
20141013,Apple to roll out iPhone 6 in 36 new markets by end of October,0.13636363636363635,0.45454545454545453,pos
20141013,Competitive Pressures Loom over TSMC,0.0,0.0,neu
20141013,New Penney CEO Has Strong Background in Operations,0.2848484848484848,0.5939393939393939,pos
20141013,The Morning Ledger: CFOs Challenged to Put a Price Tag on Company Data,0.0,0.0,neu
20141014,Ireland to Close 'Double Irish' Tax Loophole,0.0,0.0,neu
20141014,At Work | New Silicon Valley Perk: Paying for Egg Freezing,0.13636363636363635,0.45454545454545453,pos
20141014,Burberry Sales Growth Slows,0.0,0.0,neu
20141014,Saudi Prince Disagrees With Oil Minister on Petroleum Prices,0.0,0.0,neu
20141014,Apple and Facebook's Newest Perk: Freezing Your Eggs,0.0,0.0,neu
20141014,Where to Buy the New iPhone 6 in India,0.13636363636363635,0.45454545454545453,pos
20141014,The Morning Download: Salesforce's New Analytics Platform Reflects Cloud's Growing Reach,0.13636363636363635,0.45454545454545453,pos
20141014,Metallica Red Hot Chili Peppers Enlist Start-up in Hunt for Royalties,0.125,0.42500000000000004,pos
20141014,The Morning Ledger: Who Needs a CFO? Everyone Almost,0.0,0.0,neu
20141014,Skyworks Solutions Boosts 4Q View,0.0,0.0,neu
20141014,J.C. Penney's Next CEO Will Need to Give Texas a Try,0.0,0.0,neu
20141014,Morning MoneyBeat Europe: Stocks Called Lower Again Key Earnings Loom,0.0,1.0,neu
20141015,GT Advanced Confidentiality Hearing With Apple Delayed,0.4,0.6,pos
20141015,U.S. Retail Sales Fall 0.3% in September,0.0,0.0,neu
20141015,EU's Antitrust Chief Decries Political Pressure in Google Case,0.0,0.1,neu
20141015,Small-Company Stocks Shine on Rocky Day of Trading,0.0,0.0,neu
20141015,GameStop's Holiday Pitch: More Layaway Generous Financing,0.5,0.5,pos
20141015,Startup Builds Business Software for Google Glass Smartwatches,0.0,0.0,neu
20141015,iPhone Couldn't Save September's Disappointing Retail Numbers,-0.6,0.7,neg
20141015,The Morning Download: IBM-SAP Pact Reflects Rise of Hybrid Cloud,0.0,0.0,neu
20141015,5 Things To Read Today: U.S. Stocks Sink Texas Ebola Patient Flew to Ohio And More,0.5,0.5,pos
20141015,Google Unveils Nexus 6 Phone to Rival iPhone 6,0.0,0.0,neu
20141015,EU Antitrust Chief Decries 'Irrational' Response to Google Probe,0.0,0.0,neu
20141015,EBay's PayPal Keeps Gaining on Core Marketplace Division,0.0,0.0,neu
20141015,Lenovo to Establish New Mobile Phone Company in China,0.13636363636363635,0.45454545454545453,pos
20141015,The Morning Ledger: Multinational Tax Strategies Under Fire Around the Globe,0.0,0.0,neu
20141015,Gaming's Smaller Studios Feel Candy Crushed,-0.05,0.3,neg
20141015,Asian Morning Briefing: U.S. Stocks Slide But Come Off Lows,0.0,0.0,neu
20141016,Apple Pay Draws Hundreds of Banks,0.0,0.0,neu
20141016,Apple Unveils iPad Air 2 iMac,0.0,0.0,neu
20141016,Commission's Tax Drive Unsettles Multinationals,0.0,0.0,neu
20141016,CMO Today: HBO Rocks Pay TV Universe,0.0,0.0,neu
20141016,Corporate Watch: News Digest,0.0,0.0,neu
20141016,Visa Searching for a CIO,0.0,0.0,neu
20141016,The Morning Download: Microsoft Opens Up the Container with Docker Deal,0.0,0.0,neu
20141016,FBI Chief Warns Phone Encryption May Have Gone Too Far,0.1,1.0,pos
20141016,Japan Display Shares Drop 18%,0.0,0.0,neu
20141016,Kids Games Device Osmo Secures $12M Hits Apple Retail Stores,0.0,0.0,neu
20141016,A Death Rattle for 'Two-and-20',0.0,0.0,neu
20141016,U.S. Stocks End Mixed; Dow Drops,0.0,0.25,neu
20141016,FBI Chief: Pendulum on Privacy 'Has Swung too Far',0.1,1.0,pos
20141016,The Daily Docket: GT Advanced Halts Confidentiality Hearing,0.2,0.3,pos
20141016,TSMC Posts Record Profit,0.0,0.0,neu
20141017,LVMH: It May be Time for a Smartwatch,0.0,0.0,neu
20141017,iPhone 6 Starts Selling in Delhi...Eventually,0.0,0.0,neu
20141017,Technisys Raises $13M From Intel and Others for Latin American Banking,0.0,0.0,neu
20141017,Meet Sony Corp. the Auto-Parts Maker,0.0,0.0,neu
20141017,Forward Motions: Court to Hear GT Advanced Privacy Concerns,0.4,0.6,pos
20141017,The Morning Download: Apple Deepens Its Business Customer Courtship,0.0,0.0,neu
20141017,The Morning Ledger: Manufacturers Employers Remain Steady Amid Tumult,0.16666666666666666,0.5,pos
20141017,Morning MoneyBeat: Mom and Pop Not Abandoning Stocks Just Yet,0.0,0.0,neu
20141017,Family Dollar's Apple Device Move Brings App Development Challenge,0.0,0.0,neu
20141017,Apple's Real iPad Surprise: A SIM Card That Lets Users Swap Data Plans,0.2,0.30000000000000004,pos
20141017,First Impressions of the iPad Air 2: Refreshed but Not Reinvented,0.25,0.3333333333333333,pos
20141017,5 Things To Read Today: Obama Names 'Ebola Czar' Fannie Freddie Near Deal to Boost Mortgages And More,0.3,0.45,pos
